<?xml version="1.0"?>
<configuration
  xmlns="https://dueca.tudelft.nl/platform"
  xmlns:xsi="http://www.w3.org/2001/XMLSchema-instance"
  xsi:schemaLocation="https://dueca.tudelft.nl/platform https://dueca.tudelft.nl/schemas/platform.xsd">
  <!-- Set-up for a manual control task on the HMI laboratory.

       - zeronode dutmms1, class hmi-ecs
       - master node dutmms4, class hmi-io
       - display node dutmms2, class hmi-efis

  -->
  <machineclasses>
    <machineclass name="hmi-ecs" gui="gtk4" />
    <machineclass name="hmi-io" gui="none">
      <config>
        # variant, can choose real hardware (hmi) or hmi-sim
        set(HMI_VARIANT hmi CACHE STRING "Choose a variant for the HMI io")

        # Find the relevant headers
        find_path(HMIIO_BASE_DIR NAMES
                hmi/HardwareInterface.hxx hmi/hmiio_calib_volts.h REQUIRED
                PATHS ${CMAKE_SOURCE_DIR}/../../gen-ecat-io)

        list(APPEND HMIIO_INCLUDE_DIRS
                ${HMIIO_BASE_DIR}/hmi
                ${HMIIO_BASE_DIR}
                ${HMIIO_BASE_DIR}/build-${HMI_VARIANT})

        find_library(HMIIO_LIBRARY NAMES hmi-ecat-io REQUIRED
          PATHS ${HMIIO_BASE_DIR}/build-${HMI_VARIANT})

        # define PROJECT_LIBRARIES with libraries needed on the current platform,
        set(PROJECT_LIBRARIES ${HMIIO_LIBRARY})

        # define PROJECT_INCLUDE_DIRS with include directories common to all on
        # the current platform
        set(PROJECT_INCLUDE_DIRS ${HMIIO_INCLUDE_DIRS})
      </config>
      <modules>
        <project>
          <url>dgrbase:///CSControlLoading.git</url>
          <module>IOController</module>
        </project>
        <project>
          <url>dgrbase:///CSControlLoading.git</url>
          <module>ControlLoading</module>
        </project>
        <project>
          <url>dgrbase:///CSControlLoading.git</url>
          <module pseudo="true">CLConfigurations</module>
        </project>
        <project>
          <url>dgrbase:///CSControlLoading.git</url>
          <module>cl-analyser</module>
        </project>
      </modules>
    </machineclass>
    <machineclass name="hmi-efis" gui="none" />
  </machineclasses>
  <platform name="hmilab" comm-master="dutmms4">
    <scriptlet place="## [nodes]">
      ecs_node = 0      # experiment control station, node 0 with gui
      cl_node = 1       # dutmms4
      pfd_node = 2      # dutmms2
    </scriptlet>
    <node name="dutmms1" machineclass="hmi-ecs" node-number="0" if-address="192.168.2.1"/>
    <node name="dutmms4" machineclass="hmi-io" node-number="1" comm-master="true" if-address="192.168.2.4" highest-prio="5"/>
    <node name="dutmms2" machineclass="hmi-efis" node-number="2" if-address="192.168.2.2" />
  </platform>
</configuration>
